{
  "schema": "aoa_4pda_evidence_packet_v1",
  "packet_id": "example-packet-bootloop",
  "query": "redmi note 10 recovery bootloop boot.img",
  "created_at": "2026-06-15T00:00:00Z",
  "results": [
    {
      "source_url": "https://4pda.to/forum/index.php?showtopic=000001&st=0#entry1002",
      "topic_id": "synthetic-topic-1",
      "post_id": "1002",
      "snippet": "User reports bootloop after flashing recovery. Suggested fix: restore boot.img.",
      "score": 1.0,
      "evidence_refs": ["post:1002"]
    }
  ],
  "policy": {
    "source": "synthetic_fixture",
    "internal_search_used": false
  }
}

